{
  "schema_version": "1.0.0",
  "canonical_revision_id": "rev-b85e77022251b045cfe38b7d",
  "performance_session_id": "session-slow",
  "evaluation_digest": "sha256:1d0b64cdd31a2691ff8a536a063639eb57bcc11a4ebb0c8cd5d88de34306ed12",
  "policy_version": "teaching-guidance-v1",
  "items": [
    {
      "schema_version": "1.0.0",
      "finding_id": "timing-late-0001",
      "finding_type": "late_entry",
      "severity": "focus",
      "evidence_refs": [
        "aligned:ev-1"
      ],
      "message_key": "finding.late_entry",
      "canonical_event_id": "ev-1",
      "observed_value": 140.0,
      "threshold_value": 100.0,
      "zone_context": null
    },
    {
      "schema_version": "1.0.0",
      "finding_id": "timing-late-0002",
      "finding_type": "late_entry",
      "severity": "focus",
      "evidence_refs": [
        "aligned:ev-2"
      ],
      "message_key": "finding.late_entry",
      "canonical_event_id": "ev-2",
      "observed_value": 140.0,
      "threshold_value": 100.0,
      "zone_context": null
    },
    {
      "schema_version": "1.0.0",
      "finding_id": "timing-late-0003",
      "finding_type": "late_entry",
      "severity": "focus",
      "evidence_refs": [
        "aligned:ev-3"
      ],
      "message_key": "finding.late_entry",
      "canonical_event_id": "ev-3",
      "observed_value": 140.0,
      "threshold_value": 100.0,
      "zone_context": null
    }
  ],
  "next_action": {
    "schema_version": "1.0.0",
    "action_type": "slow_down",
    "reason_finding_ids": [
      "timing-late-0001",
      "timing-late-0002",
      "timing-late-0003"
    ],
    "message_key": "action.slow_down",
    "target_rate": 0.75,
    "focus_start_tick": null,
    "focus_end_tick": null,
    "teaching_aid": null
  },
  "guidance_digest": "sha256:5e604ef80e6587bd162d321789afb457d3fc4367c0303a06a8d841d3e429d9de",
  "provenance": {
    "evaluation_digest": "sha256:1d0b64cdd31a2691ff8a536a063639eb57bcc11a4ebb0c8cd5d88de34306ed12",
    "producer": "TeachingGuidanceProjectionV1/v1"
  }
}
